{"activation_token_sha256":"1c88aa885c2a990f626208e72cc420bb199c28f2a64b265b40e1d672605d141c","authority_sets_sha256":"f548b3283f02a55f07fc4ee4bca19d1699d1488ba60081405f169d7f9eabe658","contract_id":"release.bom.native.stop.authority.trust/v1","device_binding_id":null,"device_route_assignment_authorities":[{"activation_token_sha256":"1c88aa885c2a990f626208e72cc420bb199c28f2a64b265b40e1d672605d141c","auth_scope":"windows-edge-supervisor:device-route-assignment:issue","policy_id":"SOUL-ISO-001","producer_module":"factory-release-controller","release_bom_generation":2,"revoked":false,"rotation_epoch":6,"route_authority_id":"device-route-authority-a","route_authority_sha256":"d8005e2774460102cdf607fa500a0dea684c1fabfc6ca8935e30ea88844e2c5a","route_signer_key_id":"p256_spki_4444444444444444444444444444444444444444444444444444444444444444","route_signer_p256_spki_sha256":"4444444444444444444444444444444444444444444444444444444444444444","signature_algorithm":"ECDSA_P256_SHA256","signature_format":"IEEE_P1363_FIXED_FIELD_LOW_S","supervisor_artifact_id":"dps.windows-edge-supervisor","supervisor_artifact_sha256":"b93f7a30b7c56dd6a48ffbe8b21f2531280eda252e1ae5a75570cef13c7ad83c","supervisor_generation":8,"supervisor_instance_id":"si_22222222222222222222222222222222","supervisor_module_id":"windows-edge-supervisor","supervisor_version":"1.0.0","valid_from":"2026-07-01T00:00:00.0000002Z","valid_until":"2026-07-31T00:00:00.0000002Z"}],"device_route_assignment_authorities_sha256":"519c0ef9f495fef2cd0a9de80f0eeee0967bfda0d297bee0bdd2fa180b6a42ef","idempotency_key":"idem_cceec747344ad3d38ba732b788fb6e896477d243216c4e2b20c28dba8804f296","integration_commit":"37c167e44b62dd462bdc993152e2405607744a83","native_stop_authorities":[{"activation_token_sha256":"1c88aa885c2a990f626208e72cc420bb199c28f2a64b265b40e1d672605d141c","auth_scope":"policy-approval:native-stop-proof:v2:commit-unknown","authority_id":"native-stop-authority-a","key_id":"worker-native-stop-key-a","native_stop_contract_id":"native.stop.proof/v2","p256_spki_sha256":"3333333333333333333333333333333333333333333333333333333333333333","policy_id":"RESULT-VERIFY-001","producer_module":"windows-edge-worker","release_bom_generation":2,"revoked":false,"rotation_epoch":5,"signature_algorithm":"ECDSA_P256_SHA256","signature_format":"IEEE_P1363_FIXED_FIELD","valid_from":"2026-07-01T00:00:00.0000001Z","valid_until":"2026-07-31T00:00:00.0000001Z","worker_artifact_id":"dps.windows-edge-worker","worker_artifact_sha256":"359051ff483e0d5b57b4c327e9b7a2348254f82c5d6f72bbea9802760c64e3a3","worker_authority_sha256":"48c9f6e9d2525d46265b753a174ca68200b17aa97855793eba6da213372cb9ae","worker_generation":7,"worker_instance_id":"wi_11111111111111111111111111111111","worker_module_id":"windows-edge-worker","worker_slot":"A","worker_version":"1.0.0"}],"native_stop_authorities_sha256":"c1aa8e9ddef1dff37c871687fb4a4a344374b0e717b7be165d4055b300c2f1d1","native_stop_challenge_authorities":[{"activation_token_sha256":"1c88aa885c2a990f626208e72cc420bb199c28f2a64b265b40e1d672605d141c","auth_scope":"policy-approval:native-stop-challenge:v1:issue","authority_id":"native-stop-challenge-authority-a","challenge_authority_sha256":"5ec537c858879abcd013701935b5f1d5e6dbc4f70a45bf274312f9232f62c618","key_id":"policy-challenge-key-a","native_stop_challenge_contract_id":"native.stop.challenge/v1","p256_spki_sha256":"5555555555555555555555555555555555555555555555555555555555555555","policy_artifact_id":"dps.policy-approval","policy_artifact_sha256":"72453a0a3c32fb600c8b5a75c8f6a3c445f9f1d6f0406bd291af2e7b443a0791","policy_generation":9,"policy_id":"NATIVE-STOP-CHALLENGE-001","policy_instance_id":"pi_33333333333333333333333333333333","policy_module_id":"policy-approval","policy_version":"1.0.0","producer_module":"policy-approval","release_bom_generation":2,"revoked":false,"rotation_epoch":7,"signature_algorithm":"ECDSA_P256_SHA256","signature_format":"IEEE_P1363_FIXED_FIELD_LOW_S","valid_from":"2026-07-01T00:00:00.0000003Z","valid_until":"2026-07-31T00:00:00.0000003Z"}],"native_stop_challenge_authorities_sha256":"e685f4cf53fb921565f92123b18ef570a9dc9901049b720a2c7e9dfaf2260f5c","occurred_at":"2026-07-14T00:00:00.0000001Z","platform_account_id":null,"privacy_class":"internal","producer_module":"factory-release-controller","receipt_id":"native-stop-trust-99999999999999999999999999999999","release_bom_generation":2,"release_bom_id":"candidate-bom-001","release_bom_sha256":"12d7aea0c4ac121ad7e453a335baaf6d4a132de3a719fc7eeb0d2c09a49ff84b","schema_version":"1.0.0","signature":{"algorithm":"rsa-pss-sha256","key_id":"trust-receipt-key","value":"IR6+XHMegfLYd7D8Bkh0LafVGA4TsLTU+FmHVsjLQccqrYwX/C2/CqxDJseNsqEPB6oXq6HONlbWLc2G1+xaCNQkIcLrcSLOk0Q8LoZoeeCi50QNChAb6dp2VcBmvtlTtFurtUo/uHSCP6U0H1Ey7V7wg8Wu0SuyCFNZdA7buwY="},"soul_id":null,"trace_id":"trace_88888888888888888888888888888888","trust_policy_id":"release-policy-001"}